{
  "schema": "KnotAsset",
  "$schema": "https://knot-engine.local/schema/knot-asset-v1.schema.json",
  "schemaVersion": 1,
  "id": "grid-example",
  "name": "Grid diagram example",
  "units": "m",
  "elements": [],
  "representations": [],
  "diagrams": [
    { "id": "grid", "type": "grid", "size": 5, "x": [0, 1, 2, 3, 4], "o": [2, 3, 4, 0, 1] }
  ]
}
