{
  "schema": "KnotAsset",
  "$schema": "https://knot-engine.local/schema/knot-asset-v1.schema.json",
  "schemaVersion": 1,
  "id": "twisted-loop",
  "units": "m",
  "elements": [
    {
      "id": "rope-1",
      "type": "rope",
      "topology": "closed",
      "ends": [],
      "diameter": 0.01
    }
  ],
  "representations": [
    {
      "id": "view-3d",
      "dimension": 3,
      "snapshots": [
        {
          "id": "rest",
          "elements": [
            {
              "id": "rope-1",
              "geometry": {
                "type": "curve",
                "closed": true,
                "interpolation": {
                  "type": "catmullrom",
                  "tension": 0.7
                },
                "points": [
                  [
                    -0.04,
                    0.03,
                    -0.01
                  ],
                  [
                    -0.08,
                    0.0,
                    0.0
                  ],
                  [
                    -0.04,
                    -0.03,
                    0.01
                  ],
                  [
                    0.04,
                    0.03,
                    0.01
                  ],
                  [
                    0.08,
                    0.0,
                    0.0
                  ],
                  [
                    0.04,
                    -0.03,
                    -0.01
                  ]
                ]
              }
            }
          ]
        }
      ],
      "presentation": {
        "camera": {
          "position": [
            0.0,
            0.1,
            0.26
          ],
          "target": [
            0.0,
            0.0,
            0.0
          ],
          "fov": 55
        },
        "preset": "light-outline-v1"
      }
    }
  ]
}
