{
  "schema": "KnotAsset",
  "$schema": "https://knot-engine.local/schema/knot-asset-v1.schema.json",
  "schemaVersion": 1,
  "id": "overhand",
  "units": "m",
  "elements": [
    {
      "id": "open",
      "type": "rope",
      "topology": "open",
      "ends": [
        {
          "id": "a"
        },
        {
          "id": "b"
        }
      ],
      "diameter": 0.0092
    }
  ],
  "representations": [
    {
      "id": "view-3d",
      "dimension": 3,
      "snapshots": [
        {
          "id": "rest",
          "elements": [
            {
              "id": "open",
              "geometry": {
                "type": "curve",
                "closed": false,
                "interpolation": {
                  "type": "catmullrom",
                  "tension": 0.5
                },
                "points": [
                  [
                    -0.1,
                    0.0,
                    0.0
                  ],
                  [
                    -0.08,
                    0.0,
                    0.006
                  ],
                  [
                    -0.06,
                    0.001,
                    0.01
                  ],
                  [
                    -0.04,
                    0.0034999999999999996,
                    0.006999999999999999
                  ],
                  [
                    0.005,
                    0.013999999999999999,
                    -0.008
                  ],
                  [
                    0.037000000000000005,
                    0.02,
                    0.003
                  ],
                  [
                    0.057999999999999996,
                    0.006999999999999999,
                    0.0025
                  ],
                  [
                    0.057999999999999996,
                    -0.02,
                    0.001
                  ],
                  [
                    0.038,
                    -0.044000000000000004,
                    0.0
                  ],
                  [
                    0.0,
                    -0.054000000000000006,
                    0.0
                  ],
                  [
                    -0.038,
                    -0.044000000000000004,
                    0.0
                  ],
                  [
                    -0.057999999999999996,
                    -0.02,
                    -0.001
                  ],
                  [
                    -0.057999999999999996,
                    0.006999999999999999,
                    -0.0025
                  ],
                  [
                    -0.037000000000000005,
                    0.02,
                    -0.003
                  ],
                  [
                    -0.005,
                    0.013999999999999999,
                    0.008
                  ],
                  [
                    0.04,
                    0.0034999999999999996,
                    -0.006999999999999999
                  ],
                  [
                    0.06,
                    0.001,
                    -0.01
                  ],
                  [
                    0.08,
                    0.0,
                    -0.006
                  ],
                  [
                    0.1,
                    0.0,
                    0.0
                  ]
                ]
              }
            }
          ]
        }
      ]
    }
  ]
}
